name,formatted_address,vicinity,formatted_phone_number,international_phone_number,location-lat-lng,location-lat,location-lng,permanently_closed,rating,types,url,website,place_id
"Aakash Papers","Snehalata Abasan, 266, Dum Dum Road, Opposite Grihasree Chatakal, Dum Dum Road, Kolkata, West Bengal 700074, India","Snehalata Abasan, 266, Dum Dum Road, Opposite Grihasree Chatakal, Dum Dum Road, Kolkata","033 2579 8698","+91 33 2579 8698","22.622688,88.413294",22.622688,88.413294,,,establishment,https://plus.google.com/113806634502656885480/about?hl=en-US,,ChIJ6-P0k4yd-DkRWOtYF5YxenM
"A Kg Paper Traders","1, Chitpur Ghat Lane, Cossipore, Cossipore, Kolkata, West Bengal 700002, India","1, Chitpur Ghat Lane, Cossipore, Cossipore, Kolkata","033 2532 6823","+91 33 2532 6823","22.611182,88.369541",22.611182,88.369541,,,establishment,https://plus.google.com/106543258148842761833/about?hl=en-US,,ChIJUcHA0Cl2AjoRqloL03d44wE
"Asharji Enterprise","21/2/4, Bihari Lal Paul Street, Baranagar, Baranagar, Kolkata, West Bengal 700036, India","21/2/4, Bihari Lal Paul Street, Baranagar, Baranagar, Kolkata","033 2578 5054","+91 33 2578 5054","22.640368,88.372043",22.640368,88.372043,,,establishment,https://plus.google.com/108678879470530485145/about?hl=en-US,,ChIJQZPXTqOd-DkRzQKyATB1HmY
"Modern Cardboard & Corrogated Industries","119, Rajdanga Gold Park, Anandapur, Anandapur, Kolkata, West Bengal 700107, India","119, Rajdanga Gold Park, Anandapur, Anandapur, Kolkata","033 2442 1645","+91 33 2442 1645","22.514463,88.409485",22.514463,88.409485,,,establishment,https://plus.google.com/107790017443211872940/about?hl=en-US,,ChIJ____T_hzAjoRrOacZorSyKU
"Corrugating & Paper Processing Co (P) Lt","Bf125, Salt Lake, Salt Lake, Kolkata, West Bengal 700064, India","Bf125, Salt Lake, Salt Lake, Kolkata","033 2321 9364","+91 33 2321 9364","22.584028,88.415468",22.584028,88.415468,,,establishment,https://plus.google.com/106583161834659347796/about?hl=en-US,,ChIJGQs9UcF1AjoR2vsA_ptYoCg
"Ashok Enterprises","279, Rai Bahadur Road, New Alipore, New Alipore, Kolkata, West Bengal 700053, India","279, Rai Bahadur Road, New Alipore, New Alipore, Kolkata","033 2403 3080","+91 33 2403 3080","22.514358,88.325146",22.514358,88.325146,,,establishment,https://plus.google.com/110530227044681287047/about?hl=en-US,,ChIJ____v6pwAjoRy_MwDiPf1UY
"Laminated Products Ltd","21, Chandi Tala Main Road, New Alipore, New Alipore, Kolkata, West Bengal 700053, India","21, Chandi Tala Main Road, New Alipore, New Alipore, Kolkata","033 2403 3365","+91 33 2403 3365","22.514358,88.325146",22.514358,88.325146,,,establishment,https://plus.google.com/111953768792275798767/about?hl=en-US,,ChIJ____v6pwAjoRYrzwJ0PM6f8
"Wengal Corrugated Gum Factory","279, Rai Bahadur Road, New Alipore, New Alipore, Kolkata, West Bengal 700053, India","279, Rai Bahadur Road, New Alipore, New Alipore, Kolkata","033 2403 5094","+91 33 2403 5094","22.514358,88.325146",22.514358,88.325146,,,establishment,https://plus.google.com/117033578266471937032/about?hl=en-US,,ChIJ____v6pwAjoRx4zyhKHL8M0
"GRD Paper Mill","National Highway 6, Chamrail, Howrah, West Bengal 711205, India","National Highway 6, Chamrail, Howrah",,,"22.641499,88.305868",22.641499,88.305868,,,establishment,https://plus.google.com/108818642685158098968/about?hl=en-US,,ChIJOx8rI8KC-DkRXSnNdTj7Tuw
"Jyoti Fabricator & Erectors","136/5, Ashok Nagar, Ashok Nagar, Kolkata, West Bengal 700032, India","136/5, Ashok Nagar, Ashok Nagar, Kolkata","094330 13143","+91 94330 13143","22.490012,88.348768",22.490012,88.348768,,,establishment,https://plus.google.com/111987222072184705912/about?hl=en-US,,ChIJ7TsgO-pwAjoRvqw0ORmGCOs
"Punjani Graphics Private Limited","P41, Kasba Industrial, Estate Haltu, Estate Haltu, Kolkata, West Bengal 700078, India","P41, Kasba Industrial, Estate Haltu, Estate Haltu, Kolkata","033 2442 7648","+91 33 2442 7648","22.507562,88.389477",22.507562,88.389477,,,establishment,https://plus.google.com/100924542337298239240/about?hl=en-US,,ChIJVVVVVU5xAjoRhoMLPv5Q_yg
"Films & Printers (India) Private Limited","P28, E M By Pass, Haltu, Haltu, Kolkata, West Bengal 700078, India","P28, E M By Pass, Haltu, Haltu, Kolkata","033 2442 6646","+91 33 2442 6646","22.507562,88.389477",22.507562,88.389477,,,establishment,https://plus.google.com/112792058707508382158/about?hl=en-US,,ChIJVVVVVU5xAjoR2RyhubStM90
"Shree Krishna Packaging Co Private Limited","16, Dum Dum Road, Dumdum, Dum Dum Road, Kolkata, West Bengal 700028, India","16, Dum Dum Road, Dumdum, Dum Dum Road, Kolkata","033 2243 3541","+91 33 2243 3541","22.618814,88.391039",22.618814,88.391039,,,"store / establishment",https://plus.google.com/103580509843801743194/about?hl=en-US,,ChIJ6-P0k4yd-DkRbd11g08HQvg
"Mayur Paper Products","Ashwini Nagar, Baguiati, Newtown, Kolkata, West Bengal 700159, India","Ashwini Nagar, Baguiati, Newtown, Kolkata","033 2571 1333","+91 33 2571 1333","22.608517,88.431301",22.608517,88.431301,,,establishment,https://plus.google.com/115097296219490389524/about?hl=en-US,,ChIJq6qq-iWe-DkRn31HbGlRkzA
"Cardboard Shop","Daulatpur Road, Gumar Gala, Maheshtala, Maheshtala, West Bengal 700137, India","Daulatpur Road, Gumar Gala, Maheshtala, Maheshtala",,,"22.493578,88.226151",22.493578,88.226151,,,"store / establishment",https://plus.google.com/110005151298686860337/about?hl=en-US,,ChIJYXwo0j98AjoRj-FD7zRefqU
"Paper Mill Office","State Highway 2, Housing Estate Colony, Dankuni, West Bengal 712310, India","State Highway 2, Housing Estate Colony, Dankuni",,,"22.684515,88.304345",22.684515,88.304345,,,establishment,https://plus.google.com/117220220168765914399/about?hl=en-US,,ChIJlw8BnWqD-DkRaR9OHGisMXY
"Paper Mill",India,India,,,"22.639758,88.473337",22.639758,88.473337,,,"bus_station / transit_station / establishment",https://maps.google.com/maps/place?cid=18393200591541260469,http://cstc.org.in/,ChIJL3REYYyf-DkRtVBSlXzGQf8
"Paper Mill",India,India,,,"22.639667,88.473457",22.639667,88.473457,,,"bus_station / transit_station / establishment",https://maps.google.com/maps/place?cid=15027633684933850456,http://cstc.org.in/,ChIJI4_JY4yf-DkRWDUtdTfhjNA
"Paper House","65/2, Biren Road West, Birji Road, Kolkata, West Bengal 700008, India","65/2, Biren Road West, Birji Road, Kolkata","098308 22331","+91 98308 22331","22.466638,88.38657",22.466638,88.38657,,,establishment,https://plus.google.com/114606215143459247489/about?hl=en-US,,ChIJ1ShkcJ5xAjoRMqqeUwCeusQ
"Maya Packaging Industries","8, Bakarhat Road, Thakurpukur, Thakurpukur, Kolkata, West Bengal 700063, India","8, Bakarhat Road, Thakurpukur, Thakurpukur, Kolkata","033 2467 0973","+91 33 2467 0973","22.460607,88.312997",22.460607,88.312997,,,"store / establishment",https://plus.google.com/115925684244197350672/about?hl=en-US,,ChIJ9UdurYx6AjoRtsxdHJJJS0M
"Joy Ram Paper House","62/A, Bansdroni Government Koloni, Bansdroni, Kolkata, West Bengal 700070, India","62/A, Bansdroni Government Koloni, Bansdroni, Kolkata","097482 87181","+91 97482 87181","22.468524,88.362114",22.468524,88.362114,,,establishment,https://plus.google.com/114319406647535154336/about?hl=en-US,,ChIJo1IMWFVwAjoRahACoi9zE1o
"Emami Paper Mills Limited","No.15/2, Rani Rashmoni Rd, R.N.Tagore Rd, May Dibas Pally, Dakshineswar, Kolkata, West Bengal 700035, India","No.15/2, Rani Rashmoni Rd, R.N.Tagore Rd, May Dibas Pally, Dakshineswar, Kolkata",,,"22.655203,88.358677",22.655203,88.358677,,,establishment,https://plus.google.com/113710422865772187287/about?hl=en-US,http://www.emamipaper.in,ChIJYSUcbwGd-DkRsmL_-wtT0tc
"Himani and Emami Factory Paper Mill","Rani Rashmoni Road, May Dibas Pally, Dakshineswar, Kolkata, West Bengal 700076, India","Rani Rashmoni Road, May Dibas Pally, Dakshineswar, Kolkata",,,"22.657183,88.358971",22.657183,88.358971,,,establishment,https://plus.google.com/100271661146249046974/about?hl=en-US,,ChIJUa_wlgGd-DkRomNm9sZOsUE
ed,"Bhagaban Manhal Street, Rani Park, SP Paul Pally, Ariadaha, Kolkata, West Bengal 700057, India","Bhagaban Manhal Street, Rani Park, SP Paul Pally, Ariadaha, Kolkata",,,"22.668396,88.374745",22.668396,88.374745,,,establishment,https://plus.google.com/113518768705901299510/about?hl=en-US,,ChIJJeEbq0-c-DkRvYHaSdNJQII
"Eastern Paper Mill","Narayanpur, Gopalpur Gram, Rajarhat, West Bengal 700052, India","Narayanpur, Gopalpur Gram, Rajarhat",,,"22.641709,88.471909",22.641709,88.471909,,,establishment,https://plus.google.com/100385122054808446708/about?hl=en-US,,ChIJf2JYy42f-DkRz9nQm4EeeE0
"Maa Tara Paper House Prop Bala Hari Das","Rishi Bankim Church Road, Birati, Rishi Bankim Chatterjee Street, Kolkata, West Bengal 700051, India","Rishi Bankim Church Road, Birati, Rishi Bankim Chatterjee Street, Kolkata","033 2539 5958","+91 33 2539 5958","22.66433,88.42706",22.66433,88.42706,,,establishment,https://plus.google.com/115296995341286636129/about?hl=en-US,,ChIJAQAAwPae-DkRVkttjDOwhi0
"Everest Paper Mills Private limited","Doharia Shailesh Nagar, Chandigarh, Madhyamgram, Gopalpur Chandigar, West Bengal 700132, India","Doharia Shailesh Nagar, Chandigarh, Madhyamgram, Gopalpur Chandigar",,,"22.670483,88.459477",22.670483,88.459477,,,establishment,https://plus.google.com/108380484491957988246/about?hl=en-US,,ChIJQTHZNQ2f-DkRjBScIb2jgYs
"Everest Laminators","Shed No 5-A, B.W. Industrial Complex, Badu Road,, Digberia, Madhyamgram,, Kolkata, West Bengal 700128, India","Shed No 5-A, B.W. Industrial Complex, Badu Road,, Digberia, Madhyamgram,, Kolkata","022 2496 8313","+91 22 2496 8313","22.696228,88.48998",22.696228,88.48998,,,establishment,https://plus.google.com/106888261130157360421/about?hl=en-US,http://www.horizonpacks.com/,ChIJzZnjH_Ch-DkRucIshZRKH0c
"Mechano Paper Machine Limited","State Highway 1, Fortune City, Madhyamgram, Kolkata, West Bengal 700132, India","State Highway 1, Fortune City, Madhyamgram, Kolkata",,,"22.679884,88.455396",22.679884,88.455396,,,establishment,https://plus.google.com/116874185860359048064/about?hl=en-US,,ChIJ432BJBSf-DkR0Q716E6MIQQ
"Paras Paper Mill","Ekford Road, Sidheshwari Para, Khardaha, Khardaha, West Bengal 700116, India","Ekford Road, Sidheshwari Para, Khardaha, Khardaha",,,"22.710385,88.379276",22.710385,88.379276,,,establishment,https://plus.google.com/113121783135704237812/about?hl=en-US,,ChIJPwvbrYub-DkRPbTvAGISVNM
"Paper Mill","National Highway 6, Barunda, West Bengal 711303, India","National Highway 6, Barunda",,,"22.459264,87.936974",22.459264,87.936974,,4.2,establishment,https://plus.google.com/106027529116709164095/about?hl=en-US,,ChIJ2317vyuaAjoRzeWgmGa1hGg
"Titagarh Paper Mills Limited","Titagarh, Kolkata, West Bengal 700119, India","Titagarh, Kolkata",,,"22.73925,88.368883",22.73925,88.368883,,,establishment,https://plus.google.com/105070691443794159992/about?hl=en-US,,ChIJGxDESaSb-DkRB47IrMB0sls
"Titagarh Paper Mill Number 1","RK Deo Path, Titagarh, Barrackpore, West Bengal 700119, India","RK Deo Path, Titagarh, Barrackpore",,,"22.741754,88.368667",22.741754,88.368667,,,establishment,https://plus.google.com/108274315440718965892/about?hl=en-US,,ChIJi7gp7KWb-DkRoJ0cqZwZwqQ
"Titaghar Paper Mills","RK Deo Path, Titagarh, Barrackpore, West Bengal 700119, India","RK Deo Path, Titagarh, Barrackpore",,,"22.742671,88.36836",22.742671,88.36836,,,establishment,https://plus.google.com/106912014790678901999/about?hl=en-US,,ChIJFZ3Z96Wb-DkR-kRBon_P2E8
"Paper Mill School","Paper Mill Road, Bangladesh","Paper Mill Road",,,"24.077358,89.049064",24.077358,89.049064,,,"school / establishment",https://plus.google.com/112975105599572686729/about?hl=en-US,,ChIJ3USu9Q6h_jkR-Izm1hK36Sg
"Paper Mill's Mosque","Paper Mill School Road, Bangladesh","Paper Mill School Road",,,"24.077512,89.049444",24.077512,89.049444,,,"mosque / place_of_worship / establishment",https://plus.google.com/111682655393541108853/about?hl=en-US,,ChIJn6ed8Q6h_jkRQVczNyGIkh0
"Furfura Sharif Complex","Paper Mill Road, Bangladesh","Paper Mill Road",,,"24.080784,89.047199",24.080784,89.047199,,,establishment,https://plus.google.com/109819325007368749404/about?hl=en-US,,ChIJOQpa8A-h_jkRUxdZjDFZPy8
"Papermill Employees Club","Paper Mill School Road, Bangladesh","Paper Mill School Road",,,"24.078287,89.049064",24.078287,89.049064,,,"amusement_park / establishment",https://plus.google.com/107774762383470134871/about?hl=en-US,,ChIJAcE3_w6h_jkRhnqehdbHpAY
"Gas Intersection","Paper Mill Road, Bangladesh","Paper Mill Road",,,"24.075136,89.050258",24.075136,89.050258,,,"gas_station / establishment",https://plus.google.com/116360560481732538362/about?hl=en-US,,ChIJx2m-GAyh_jkR-86ExwwkcA4
"Ruppur Mor Jame Masjid","Paper Mill Road, Bangladesh","Paper Mill Road",,,"24.071872,89.051198",24.071872,89.051198,,,"mosque / place_of_worship / establishment",https://plus.google.com/111191901543976206823/about?hl=en-US,,ChIJATnSnAyh_jkR3yvYs4ITmNM
"Gupta Enterprises","Jugsalai Jamshedpur - 831006, Jugsalai, Jamshedpur, Jharkhand 831006, India","Jugsalai Jamshedpur - 831006, Jugsalai, Jamshedpur","0657 229 2415","+91 657 229 2415","22.772215,86.183335",22.772215,86.183335,,,establishment,https://plus.google.com/107822654012621538136/about?hl=en-US,,ChIJP8-OmVHj9TkR463Y9vg9BpE
"Goyal Paper Udyog","M E School Road, Jugsalai, M E School Road, Jamshedpur, Bihar 831001, India","M E School Road, Jugsalai, M E School Road, Jamshedpur","0657 229 1651","+91 657 229 1651","22.760513,86.204856",22.760513,86.204856,,,establishment,https://plus.google.com/113868311047575519211/about?hl=en-US,,ChIJSfJy78389TkRam0_Gvo_dv0
"Deepak Paper & Board Manufacturing","Telco, T-3/64 Ashok Road, Trf Nagar, Telco, Jamshedpur - 831004, Kharangajhar, Jamshedpur, Jharkhand 831004, India","Telco, T-3/64 Ashok Road, Trf Nagar, Telco, Jamshedpur - 831004, Kharangajhar, Jamshedpur","0657 226 8760","+91 657 226 8760","22.770058,86.25989",22.770058,86.25989,,,establishment,https://plus.google.com/107094554668909025254/about?hl=en-US,,ChIJO-62HQEI9jkRm9Q0e0C6Hv8
"Sri Sai Packaging Industries","NS-2, Phase-IV, Adityapur Industrial Area,, Adityapur (Near Beco More), Jamshedpur, Jharkhand 832109, India","NS-2, Phase-IV, Adityapur Industrial Area,, Adityapur (Near Beco More), Jamshedpur","094717 11016","+91 94717 11016","22.806706,86.111065",22.806706,86.111065,,,establishment,https://plus.google.com/110462650819421780973/about?hl=en-US,,ChIJmxb-XHTl9TkRkRK1GDEuEr4
"Ballavpur Paper Mill","Bardhaman, West Bengal 713347, India",,,,"23.582169,87.12199",23.582169,87.12199,,,establishment,https://plus.google.com/101576357134295706651/about?hl=en-US,,ChIJCZWarKIR9zkRcvmJ2VbOISM
"Maa Chandi Paper Pvt Ltd","Shyampur, West Bengal 713363, India",Shyampur,,,"23.631806,87.306719",23.631806,87.306719,,,establishment,https://plus.google.com/110331352895674681056/about?hl=en-US,,ChIJz30p4qVu9zkRMSJGEpF21Uk
Impact,"Kalyaneshwari to Dendua, Nakrajuria, West Bengal 713369, India","Kalyaneshwari to Dendua, Nakrajuria",,,"23.77889,86.85551",23.77889,86.85551,,,establishment,https://plus.google.com/109315393472340135721/about?hl=en-US,,ChIJ84kWJ1be9jkRPNjRT_Bxtcs
"Paper Mart","G T Road, Asansol, West Bengal 713301, India","G T Road, Asansol","0342 220 3518","+91 342 220 3518","23.694733,86.948825",23.694733,86.948825,,,establishment,https://plus.google.com/114785850205471151797/about?hl=en-US,,ChIJXWHatAUf9zkRu8-kJF7D_9g
"Kedia Paper Agency","27, Pucca Bazar, Pucca Bazar, Asansol, West Bengal 713301, India","27, Pucca Bazar, Pucca Bazar, Asansol","0342 220 4236","+91 342 220 4236","23.68721,86.973343",23.68721,86.973343,,,establishment,https://plus.google.com/106268217362987384981/about?hl=en-US,,ChIJX8gtESgf9zkRYPY06itP7M8
"Bengal Paper Mill School","vill post:ballavpur, Raniganj, West Bengal 713323, India","vill post:ballavpur, Raniganj",,,"23.578121,87.120383",23.578121,87.120383,,,"school / establishment",https://plus.google.com/103328915154391149674/about?hl=en-US,,ChIJ5T5esL0R9zkRDwlqXvypc3M
"Ballavpur Paper Mill Institute","Raniganj, West Bengal 713323, India",Raniganj,,,"23.584021,87.121284",23.584021,87.121284,,,establishment,https://plus.google.com/111703668112982736164/about?hl=en-US,,ChIJ0Uypk6IR9zkRsFIN-9ZfNDs
"GUPTA STEELS","G.T. Road, Raniganj More, P.O. Searsole Rajbari, Dist. - Burdwan, Raiganj , West Bengal, West Bengal 713358, India","G.T. Road, Raniganj More, P.O. Searsole Rajbari, Dist. - Burdwan, Raiganj , West Bengal","094340 22447","+91 94340 22447","23.637616,87.11298",23.637616,87.11298,,,establishment,https://plus.google.com/100115292696278926629/about?hl=en-US,http://guptasteels.tradeindia.com/,ChIJ_____zMR9zkRh6mKlt_r-S8
"Round Bars and Tmt Bars Manufacturer, Supplier In Kolkata","G.T. Road, Raniganj More, P.O. Searsole Rajbari,, Dist. - Burdwan,, Raiganj ,, West Bengal 713358, India","G.T. Road, Raniganj More, P.O. Searsole Rajbari,, Dist. - Burdwan,, Raiganj ,","094340 21431","+91 94340 21431","23.637616,87.11298",23.637616,87.11298,,,establishment,https://plus.google.com/100471040828400576334/about?hl=en-US,http://guptasteels.tradeindia.com/,ChIJAQAAcDIR9zkRkYdBXB_uyUs
"Dighira Paper Mill","Dighir, West Bengal 712402, India",Dighir,,,"22.972737,88.01892",22.972737,88.01892,,,establishment,https://plus.google.com/100321858191407734285/about?hl=en-US,,ChIJ-ddGSuRn-DkR9DlFvCP60VQ
"Kankinara Paper Mill (T P M No. 2)","State Highway 1, ESD Machinery, Jagatdal, Bhatpara, West Bengal 743129, India","State Highway 1, ESD Machinery, Jagatdal, Bhatpara",,,"22.866783,88.393221",22.866783,88.393221,,,establishment,https://plus.google.com/106469796475931657358/about?hl=en-US,,ChIJR0t3ujCR-DkR24H_FmLCZ30
"Penguin Paper Box","A-8/149, Kalyani Nadia, Kalyani Nadia, Kolkata, West Bengal 741235, India","A-8/149, Kalyani Nadia, Kalyani Nadia, Kolkata","033 2582 3430","+91 33 2582 3430","22.96821,88.466842",22.96821,88.466842,,,establishment,https://plus.google.com/100702339737337189612/about?hl=en-US,,ChIJR30Mc9iU-DkRM_3XoJG_nyY
"Tribeni Tissue Paper Mill,ITC","ITC Compound Road, Chandrahati, West Bengal 712147, India","ITC Compound Road, Chandrahati",,,"23.007522,88.408828",23.007522,88.408828,,4.2,establishment,https://plus.google.com/114966587851294342413/about?hl=en-US,,ChIJOefX9lrr-DkR2OctoyIh3ts
"Supreme Paper Mill","Bhagirathi Road, Chakdaha, Raninagar, West Bengal 741222, India","Bhagirathi Road, Chakdaha, Raninagar",,,"23.073792,88.500314",23.073792,88.500314,,,establishment,https://plus.google.com/103419370290899678279/about?hl=en-US,,ChIJ5bngAZPB-DkR33g2Fxex90Y
"S.P. Paper Boardmills","88, Ghola Kachary Road, Sukanta Polli, Barasat, Kolkata, West Bengal 700124, India","88, Ghola Kachary Road, Sukanta Polli, Barasat, Kolkata",,,"22.711486,88.492734",22.711486,88.492734,,,establishment,https://plus.google.com/100893302211824372414/about?hl=en-US,,ChIJUWIBNByi-DkRyXYAtIKpXmI
"Mallick Paper Mart","199 C, Bidhan Sarani, Bidhan Sarani, Kolkata, West Bengal 700006, India","199 C, Bidhan Sarani, Bidhan Sarani, Kolkata","033 2241 1519","+91 33 2241 1519","22.729262,88.373334",22.729262,88.373334,,,establishment,https://plus.google.com/114881690455976365102/about?hl=en-US,,ChIJFRz_x09xAjoRBLQxFwnGKmc
"Paper Mill Siding",India,India,,,"22.91499,88.409027",22.91499,88.409027,,,"bus_station / transit_station / establishment",https://maps.google.com/maps/place?cid=15439614626658352686,http://cstc.org.in/,ChIJsw7gYg6U-DkRLn7lSrOHRNY
"Paper Mill Siding",India,India,,,"22.915086,88.408948",22.915086,88.408948,,,"bus_station / transit_station / establishment",https://maps.google.com/maps/place?cid=4817199695874493044,http://cstc.org.in/,ChIJq89KfQ6U-DkRdAq4zJkh2kI
"Paper Mill Bus Stand","Bansberia, Chak Bansberia, West Bengal 712502, India","Bansberia, Chak Bansberia",,,"22.957165,88.387573",22.957165,88.387573,,,"bus_station / transit_station / establishment",https://maps.google.com/maps/place?cid=3505785912184055603,,ChIJowvb_HGT-DkRM6dMcrYNpzA
"Titagrah Paper Mill Quaters","Titagarh, Titagarh, West Bengal 700119, India",Titagarh,,,"22.739272,88.370787",22.739272,88.370787,,,establishment,https://plus.google.com/101587728874302125334/about?hl=en-US,,ChIJv0yN5KSb-DkR8zbBB_IF0vg
"Progressive Paper Mill Private Limited","34/1, Behari Lal Ghosh Road, Behari Lal Ghosh Road, Kolkata, West Bengal 700057, India","34/1, Behari Lal Ghosh Road, Behari Lal Ghosh Road, Kolkata","033 2553 1625","+91 33 2553 1625","22.630164,88.385234",22.630164,88.385234,,,establishment,https://plus.google.com/111355864773722881516/about?hl=en-US,,ChIJe6yzIVN2AjoRprAoitAmwxs
"Progressive Paper Mills Private Limited","34, Behari Lal Ghosh Road, Ariadaha, Ariadaha, Kolkata, West Bengal 700057, India","34, Behari Lal Ghosh Road, Ariadaha, Ariadaha, Kolkata","033 2523 2237","+91 33 2523 2237","22.630164,88.385234",22.630164,88.385234,,,establishment,https://plus.google.com/107030267315237110011/about?hl=en-US,,ChIJe6yzIVN2AjoRk9GyP_T3KjA
"Prayas Paper Pvt Ltd","34, Behari Lal Ghosh Road, Ariadah, Behari Lal Ghosh Road, Kolkata, West Bengal 700057, India","34, Behari Lal Ghosh Road, Ariadah, Behari Lal Ghosh Road, Kolkata","033 2553 3948","+91 33 2553 3948","22.630164,88.385234",22.630164,88.385234,,,establishment,https://plus.google.com/108450655223044349822/about?hl=en-US,,ChIJO5pij-ud-DkRwF63B61Req0
"Pioneer Packaging Inds Pvt Ltd","55b, Kali Temple Road, Kali Temple Road, Kolkata, West Bengal 700026, India","55b, Kali Temple Road, Kali Temple Road, Kolkata","033 2455 5182","+91 33 2455 5182","22.663612,88.408658",22.663612,88.408658,,,"store / establishment",https://plus.google.com/103977488899745096186/about?hl=en-US,,ChIJvc7g9oae-DkRaOZjX8HQxkg
"Thermotech Engg Corpn","18a, Purbapara Road, Belgharia, Belgharia, Kolkata, West Bengal 700056, India","18a, Purbapara Road, Belgharia, Belgharia, Kolkata","033 2541 4282","+91 33 2541 4282","22.661623,88.389283",22.661623,88.389283,,,establishment,https://plus.google.com/103869257339754453623/about?hl=en-US,,ChIJ92roHDOc-DkREYy_DXxHHNQ
"Wel Pack","174, Ashokgarh, Bunlop Bridge, Dunlop, Dunlop, Kolkata, West Bengal 700108, India","174, Ashokgarh, Bunlop Bridge, Dunlop, Dunlop, Kolkata","033 2577 0236","+91 33 2577 0236","22.644401,88.370066",22.644401,88.370066,,,establishment,https://plus.google.com/105745312880780481986/about?hl=en-US,,ChIJq6qqqqWd-DkRZqDiYnkK51U
"Technomech Industrial Corpon","8, Ashokgarh, Dunlop Bridge, Dunlop Bridge, Kolkata, West Bengal 700108, India","8, Ashokgarh, Dunlop Bridge, Dunlop Bridge, Kolkata","033 2577 4338","+91 33 2577 4338","22.644401,88.370066",22.644401,88.370066,,,establishment,https://plus.google.com/108334747842040465430/about?hl=en-US,,ChIJq6qqqqWd-DkRlRy1XgoF_sA
"Khushi Enterprise","2/34, Dum Dum Road, Cossipore, Cossipore, Kolkata, West Bengal 700002, India","2/34, Dum Dum Road, Cossipore, Cossipore, Kolkata","033 2530 0827","+91 33 2530 0827","22.621694,88.404929",22.621694,88.404929,,,establishment,https://plus.google.com/106332486864970320928/about?hl=en-US,,ChIJ6-P0k4yd-DkRlD3OHx9Nx3A
"Pawan Infra Projects Pvt. India Ltd.","IV/A-5(P) 10,Bokaro Industrial Area Biada, Bokaro Steel City- 827014, Bokaro , Biada, Jharkhand 827014, India","IV/A-5(P) 10,Bokaro Industrial Area Biada, Bokaro Steel City- 827014, Bokaro , Biada","094311 42075","+91 94311 42075","23.667156,86.069436",23.667156,86.069436,,,"convenience_store / food / store / health / establishment",https://plus.google.com/117491225141301058240/about?hl=en-US,,ChIJ4QzfFR499DkRO54kKJXql4k
"ADARSH STEEL TRADERS","Katras Road, Matkuria, Dhanbad, Jharkhand 826001, India","Katras Road, Matkuria, Dhanbad","093340 01262","+91 93340 01262","23.791617,86.409872",23.791617,86.409872,,,establishment,https://plus.google.com/108910360728085396069/about?hl=en-US,http://adarshsteeltraders.tradeindia.com/,ChIJAQAAwDej9jkRPPC5sMOwooA
"Katwa Paper Mill","Srikhanda, West Bengal 713150, India",Srikhanda,,,"23.615145,88.078626",23.615145,88.078626,,,establishment,https://plus.google.com/112387907253462096950/about?hl=en-US,,ChIJwdqpjzGk-TkRWulw8Mws6Ts
"Kohinoor Paper & Newsprint","FSEZ Road, Noorpur, West Bengal 743368, India","FSEZ Road, Noorpur",,,"22.23961,88.095331",22.23961,88.095331,,,establishment,https://plus.google.com/102239594545200233913/about?hl=en-US,,ChIJn5mL5VmLAjoRhV1mI5dHVvs
"Kalipada Packaging Industries","Ashuti Main Road, Maynagore,, Banerjeepara, Maheshtala, Maheshtala, West Bengal 700141, India","Ashuti Main Road, Maynagore,, Banerjeepara, Maheshtala, Maheshtala","033 2488 0151","+91 33 2488 0151","22.488886,88.260329",22.488886,88.260329,,,"store / establishment",https://plus.google.com/103480331231046365098/about?hl=en-US,http://www.kpipaperbox.com/,ChIJq6qqZgxxAjoRTxMVFv-l2IQ
"SAFARI PACKAGING INDUSTRIES","No. 8-A, Uttarpanchanna Gram, New Area, Kolkata , West Bengal , India, West Bengal 700100, India","No. 8-A, Uttarpanchanna Gram, New Area, Kolkata , West Bengal , India","098308 57261","+91 98308 57261","22.519766,88.418576",22.519766,88.418576,,,"store / establishment",https://plus.google.com/111297856519554940343/about?hl=en-US,http://safaripackaging.tradeindia.com/,ChIJAQAAAAt0AjoR08ayUqxh3RY
"Sangido Enterprises","2, Darga Road, Beniapukur, Kolkata, West Bengal 700017, India","2, Darga Road, Beniapukur, Kolkata","033 2290 2639","+91 33 2290 2639","22.540414,88.370504",22.540414,88.370504,,,"store / establishment",https://plus.google.com/112621405753869854431/about?hl=en-US,http://www.sangido.co.in/,ChIJZ0mlTeZ2AjoROX7Ab5utte0
"Azad Enterprises","45/5 Diamond Harbour Road, Mominpur, Kolkata, West Bengal 700027, India","45/5 Diamond Harbour Road, Mominpur, Kolkata","033 2449 6539","+91 33 2449 6539","22.523264,88.324867",22.523264,88.324867,,,establishment,https://plus.google.com/105958882168289692098/about?hl=en-US,http://www.indiamart.com/azadenterprise,ChIJS2x2iFV3AjoRX3dbnwNRWS8
"Automatic Cut to Length Line Without Loop","26/52, Kaipukur lane, Shibpur, Howrah, West Bengal 711102, India","26/52, Kaipukur lane, Shibpur, Howrah","098310 19716","+91 98310 19716","22.576652,88.30465",22.576652,88.30465,,,establishment,https://plus.google.com/110702855601805685956/about?hl=en-US,,ChIJE0kviUd4AjoRbr1AmHIrJk4
