ID,Title,"Title-English Translated"
2919,"अन्य मेशिनहरु जस्तै  पंखा ,  तौलेने मेशिन , छर्कने , छाप्ने , ए. सि , आदि प्रतिष्ठानहरु वा क्रियाकलापहरु।","Other machines such as a fan, taulene machine, sprinkling, printing, e. Si, etc., installations or activities."
2921,"कृषि, पशु, र वन संवन्धि कम गर्ने साधनहरु जस्तै थेशर, कंरौती पशु आहार आदि वनाउने  क्रियाकलापहरु।","Agriculture, livestock, and forest resources to reduce such calls for thesara, kanrauti animal nutrition activities predecessors."
2922,"मेशिनका पार्टपूर्जा वनाउने जस्तै   पीध्ने , पे्रस गर्ने , चिल्याउने पुर्जा बनाउने प्रतिष्ठानहरु वा क्रियाकलापहरु।","Like its predecessors, exacerbated partapurja pidhne, Talking to, cilyaune parts making installations or activities."
2923,"धातुका मेशिनका सामान वा पार्टपूजा वनाउने प्रतिष्ठानहरु वा क्रियाकलापहरु।","Metal, exacerbated the goods or installations, or activities partapuja predecessors."
2924,"खानी तथा उत्खनन् को काममा प्रयोग हुने मेशिन उत्पादन गर्ने प्रतिष्ठानहरु वा क्रियाकलापहरु।","The machine used to work the mines and quarry production installations or activities."
2925,"खाद्य , पेय र सुर्ति जन्य वस्तु उत्पादन  गर्ने मेशिन जस्तै चुरोट वनाउने मेशिन , चिज वनाउने मेशिन , दूध प्रशोधन गर्ने मेशिन वनाउने प्रतिष्ठानहरु वा क्रियाकलापहरु।","Food, beverages and tobacco, machinery and produce goods such as cigarettes legalization of consensual machine, cheese machine GBV, GBV milk processing plant installations or activities."
2926,"कपडा वा छालाका वस्तुहरु जस्तै तान, धागो कात्ने चर्खा आदि वनाउने प्रतिष्ठानहरु वा क्रियाकलापहरु।","Fabric or leather goods such as air, spinning jenny, etc. installations or activities predecessors."
2927,"वारुद, गोली, वन्दुक आदि वनाउने प्रतिष्ठानहरु वा क्रियाकलापहरु।","Kgs, shoot, guns, etc. installations or activities predecessors."
2929,"विषेश उद्धेश्यका मेशिनहरु जस्तै   कपडा काट्ने मेशिन , टाएर वनाउने मेशीन वनाउने प्रतिष्ठानहरु।","Special purpose machines such as textile cutting machinery, taera GBV GBV Machine installations."
2930,"अन्यत्र उल्ख नगरिएका घरेलु उपकरणहरु जस्तै रेफि्रजीरेटर , पंखा , कुकर ,  हिटर , भ्याकुम क्लीनर , फलफूलको रस निचर्ने मेशिन वनाउने प्रतिष्ठानहरु वा क्रियाकलापहरु।","Elsewhere ulkha silent rephirajiretara as domestic devices, fans, cookers, heaters, vacuum cleaners, fruit juice machine legalization nicarne installations or activities."
3000,"फोटोकपी, टाइपराइटर, कम्प्युटरु, प्रीन्टर, क्यालकुलेटर आदि वनाउने प्रतिष्ठानहरु वा क्रियाकलापहरु।","Photocopying, typewriter, kampyutaru, printara, calculators, etc. installations or activities predecessors."
3110,"जेनेटर, ट्रान्सफर्मर, व्याट्री चार्जर आदि वनाउने प्रतिष्ठानहरु वा क्रियाकलापहरु।","Jenetara, transformers, battery chargers, etc. installations or activities predecessors."
3120,"विजुलीको स्विच, एम्पीयर मिटर, मिटर फ्युज आदि वनाउने प्रतिष्ठानहरु वा क्रियाकलापहरु।","Switch, ampere meter, the meter fuse, etc. installations or activities predecessors."
3130,"विजुलीको वाइरीङ्गको तार आदि वनाउने प्रतिष्ठानहरु वा क्रियाकलापहरु।","Vairingako electric wire, etc. installations or activities predecessors."
3140,"सवै प्रकारका व्याट्री वनाउने प्रतिष्ठानहरु वा क्रियाकलापहरु।","All types of battery installations or activities predecessors."
3150,"विजुली वत्तिका सामान जस्तै विजुलीको चिम,इन्फ्रा रेड चिम, फिलामेण्ट, अल्ट्राभाइलेट आदि वनाउने कार्यहरु।","Electric lighting accessories such as electric light bulb, the infra-red light bulb, philamenta, ultraviolet, etc. works legalization."
3190,"अन्यत्र उल्लेख नभएका विजुलीका सामान जस्तै  इलेक्ट्रीक कम्प्रेशर , वाइरिङ सेट , चोक वनाउने कार्यहरु।","As mentioned elsewhere goods without electricity Electric Compressor, set vairina, court actions predecessors."
3210,"विद्युतिय भल्भ , ट्यूव र विद्युतिय अन्य सामान जस्तै  फोटो क्याथोड , माइक्रो मोडल वनाउने  कार्यहरु।","Electric valves, and electronic accessories such as photo tyuva kyathoda, micro modal functions legalization."
3220,"रेडीयो, टेलीभिजन, क्यामरा, टेलिफोन आदि बनाउने क्रियाकलापहरु।","Radio, television, camera, telephone, etc. to make activities."
3230,"विभिन्न प्रकारका रिसिभरहरु जस्तै यएर फोन, क्यासेट, टेप आदि वनाउने प्रतिष्ठानहरु वा क्रियाकलापहरु।","As various kinds of risibharaharu yaera phone, cassette, tape, etc. installations or activities predecessors."
3311,"मेडीकल,सर्जिकल,अर्थोपेडिक कार्यमा प्रयोग हुने सामान वनाउने प्रतिष्ठानहरु वा क्रियाकलापहरु।","Medical, surgical, orthopedic goods to be used in the work of its predecessors installations or activities."
3312,"मापन गर्ने र नियन्त्रण गर्ने सामानहरु जस्तै थर्मोमिटर, व्यारोमिटर, मेजरिड टेप आदि वनाउने क्रियाकलापहरु।","Measurement and control products like thermometers, Barometer, mejarida tape etc. legalization activities."
3313,"औद्योगिक नियन्त्रण गर्ने वस्तुहरु जस्तै :  प्रेशर, तापक्रम, कन्ट्रोल चार्ट आदि वनाउने क्रियाकलापहरु।","Industrial control objects such as: pressure, temperature, control charts, etc. GBV activities."
3320,"चस्मा,क्यामरा, वाइनाकुलर, टेलीस्कोप आदि वनाउने प्रतिष्ठानहरु वा क्रियाकलापहरु।","Eyeglasses, cameras, vainakulara, telescope, etc. installations or activities predecessors."
3330,"घडी, घडीका पूर्जा, घडीको चेन ( मेटलको ) आदि वनाउने प्रतिष्ठानहरु वा क्रियाकलापहरु।","Clock, clock rage, clock chain (metal), etc. installations or activities predecessors."
3420,"मोटरको वडी बनाउने क्रियाकलापहरु।","Vadi vehicles making activities."
3599,"टाँगा, गाडा, रिक्सा आदि वनाउने  क्रियाकलापहरु।","Sleighs, carts, rickshaws etc. GBV activities."
3610,"घरायसी, कार्यालय, प्रयोगशाला आदिमा प्रयोगहुन फर्नीचर वनाउने प्रतिष्ठानहरु वा क्रियाकलापहरु।","Household, office, laboratory installations, or activities in the beginning, prayogahuna furniture predecessors."
3691,"सुन, चाँदी, हीरा आदिका गहना  वनाउने क्रियाकलापहरु।","Gold, silver, diamond jewelry, etc. GBV activities."
3692,"हार्विन, तवला, पियानो, मादल आदि वनाउने प्रतिष्ठानहरु वा क्रियाकलापहरु।","Harvina, drum, piano, danced, etc. installations or activities predecessors."
3693,"खेलकुदका सामान जस्तै स्पोर्ट शुज, वल, पन्जा, बोट  आदि वनाउने प्रतिष्ठानहरु वा क्रियाकलापहरु।","Sporting Goods Sport as suja, Wall, gloves, plants, etc. installations or activities predecessors."
3694,"खेलौना र खेलका सामान जस्तै पुतली, खेलौना, खेलौना मोटर, तास आदि वनाउने क्रियाकलापहरु।","Toys and games accessories such as doll, toy, toy car, card, etc. GBV activities."
3699,"छाता, टांक, कांइयो, व्रुस आदि वनाउने क्रियाकलापहरु।","Umbrella, button, kamiyo, vrusa etc. GBV activities."
3710,"खेर फालेका धातु वा धातुका टुक्रा पुनः प्रयोग गरी सामान वनाउने क्रियाकलापहरु।","Pieces of metal or metal re-use spent GBV activities and goods."
3720,"खेर फालेका कपडा र कपडाका टुक्रा पुनः प्रयोग गरी सामान वनाउने क्रियाकलापहरु।","Textiles and textile pieces, re-using spent luggage GBV activities."
4010,"विद्युत उत्पादन,संकलन र वितरण गर्ने प्रतिष्ठान वा क्रियाकलापहरु।","Electricity production, collection and distribution of establishments or activities."
4020,"ग्यांसका उत्पादन तथा वितरण जस्तै घर , उद्योग र अन्य प्रयागकर्तालाइ ग्यांस वितरण गर्ने कार्यहरु।","Gyansaka production and distribution such as home, industry and other prayagakartalai gyansa distribution functions."
4100,"पानीको संकलन  शुद्धिकरण र वितरण गर्ने प्रतिष्ठान वा क्रियाकलापहरु।","Collection and distribution of water purification installations or activities."
4510,"निर्माण स्थलको तयारी कार्य जस्तै साइट सम्म गर्ने वा वनाउने कार्यहरु।","Construction site preparation work until the site or its predecessors works like."
4520,"पुल, ढल, सडक, नहर,भवन आदि बनाउन  प्रतिष्ठान वा क्रियाकलापहरु।","Bridge, sewer, roads, canals, buildings etc. establishment or activities."
4530,"भवन वनाउदा विद्युत , पानी , इन्सुलेशन कार्य , दूरसंचारका उपकरण जडान गर्ने  कार्यहरु।","Building vanauda electricity, water, insulation work, Installation of telecommunications equipment functions."
4540,"डकर्मी, सिकर्मी र ल्पम्बिड गर्ने क्रियाकलापहरु।","Masons, carpenters, and the activities lpambida."
4550,"निर्माण गर्ने वा भत्काउने प्रयोजनका लगि डोजर , क्रेन , लरी आदि अप्रेटर सहित भाडामा लगाउने कार्यहरु।","The purpose of building or dismantling put excavators, cranes, including Laurie, etc. rented wear apretara functions."
5010,"मोटर, भेहिकलको थोक र खुद्रा विक्री गर्ने प्रतिष्ठान वा क्रियाकलापहरु।","Motor, vehicle wholesale and retail establishments selling or activities."
5020,"मोटर, भेहिकलको मर्मत र सर्भिसिड गर्ने प्रतिष्ठान वा क्रियाकलापहरु।","Motor, vehicle repair and sarbhisida the establishment or activities."
5030,"मोटर, भेहिकलको पार्ट  पूर्जाको  विक्री गर्ने प्रतिष्ठान वा क्रियाकलापहरु।","Motor, Vehicle Part rage selling establishments or activities."
5040,"मोटर, मोटरसाइकलको थोक र खुद्रा विक्री गर्ने प्रतिष्ठान वा क्रियाकलापहरु।","Motor, motor vehicle wholesale and retail establishments selling or activities."
5050,"पेट्रोलीयम पदार्थ ( पेट्रोल, डिजेल, मोबिल ) को थोक विक्री गर्ने क्रियाकलापहरु।","Petroleum products (petrol, diesel, Mobil) to wholesale and selling activities."
5110,"शुल्क लिइ वा करारका आधारमा गरिने थोक विक्री गर्ने कार्यहरु।","Charges will be forwarded, or the basis of the wholesale selling functions."
5121,"अप्रशोधित खाद्य बस्तु र जीवीत पशुपंगीको विक्री गर्ने क्रियाकलापहरु।","Untreated food items and selling activities pasupangiko yea."
5122,"प्रशोधित खाद्यन्न, फलफूल, तरकारी,चिया,कफी,सूर्ति आदिको विक्री गर्ने क्रियाकलापहरु।","Processed food supplies, fruits, vegetables, tea, coffee, tobacco, etc. and selling activities."
5131,"कपडा, लुगा, जुत्ताको थोक विक्री गर्ने क्रियाकलापहरु।","Textiles, clothing, shoes wholesale and selling activities."
5139,"घरायसी सामान जस्तै :  छाला, औषधी, कस्मेटीक सामान, इलेक्ट्रेानिक वस्तु, इलेक्ट्रीकल (विजुली) का वस्तु, पत्रीका, पुस्तक, गहना, घडी आदिको थोक विक्री गर्ने क्रियाकलापहरु।","Household goods such as leather, medicine, kasmetika goods, ilektreanika object, electrical (electric) of the object, derailment, book, jewelry, watches, etc. wholesale and selling activities."
5141,"ठोस, तरल र ग्याँस जस्ता इन्धनको थोक विक्री गर्ने क्रियाकलापहरु।","Solid, liquid and gas fuel, such as bulk selling activities."
5142,"कच्चा धातुको थोक विक्री कार्य","Wholesale sales of raw metal work"
5143,"हार्डवयर, चुन, सिमेण्टको थोक विक्री गर्ने क्रियाकलापहरु।","Hardware, choose, cement bulk and selling activities."
5149,"रसायनिक मल, अन्य मध्यबर्ति वस्तुको थोक विक्री गर्ने क्रियाकलापहरु।","Chemical fertilizers, bulk goods sold to other madhyabarti activities."
5150,"कृषि औजार, कार्यालय सामान, काठ आदिको थोक विक्री गर्ने क्रियाकलापहरु।","Agricultural tools, office furniture, wood, etc. wholesale and selling activities."
5190,"अन्य सामानको थोक विक्री जस्तै एउटै वस्तु समुहको विक्री गर्दा कुल आम्दानीको ५० प्रतिशत भन्दा कम आन्दानी हुने सामानको थोक विक्री गर्ने कार्यहरु।","Other goods such as bulk selling of the same item group sold a total income less than 50 percent of the wholesale selling works andani."
5211,"खाद्यान्न, सूर्ति, चिया, फर्निचर आदिको खुद्रा विक्री गर्ने क्रियाकलापहरु।","Food, tobacco, tea, furniture, etc. The activities Retail sales."
5219,"सामान्य पसलमा अन्य सामानको खुद्रा विक्री कार्य जस्ते  हार्डवयर , पर्निचर, कपडा, गहना , कसमेटिक आदि","General store zinc hardware accessories Retail sales work, parnicara, textiles, jewelry, etc. kasametika"
5220,"विशिष्टीकरण गरिएका वस्तु जस्ते दूध, तरकारी ,फुल , रक्सी , चुरोट आदिको सुद्रा वीक्री कार्य।","The object specialization zinc milk, vegetables, eggs, alcohol, cigarettes, etc. ChennaiEgm sudra work."
5231,"औषधि, कसमेटिक, सफाइ, बाथरुमको सामान आदिको खुद्रा विक्री गर्ने क्रियाकलापहरु।","Drug, kasametika, cleaning, etc. Retail sales of goods a bathroom activities."
5232,"कपडा, पोशाक, जुत्ता, यात्राका सामान आदिको खुद्रा विक्री गर्ने क्रियाकलापहरु।","Textiles, clothing, footwear, travel goods, etc. The activities Retail sales."
5233,"फर्निचर, मेशिन, विजुलीका सामान आदिको खुद्रा विक्री गर्ने क्रियाकलापहरु।","Furniture, machines, electricity, etc. Retail sales of goods activities."
5234,"हार्डवयर, चुन,रंग आदिको खुद्रा विक्री गर्ने क्रियाकलापहरु।","Hardware, choose, color, etc. The retail selling activities."
5239,"कार्पैट, घडी, गहना, किताव, पत्रीका, स्टेसनरी सामान,सफाइका  सामान, कम्प्यूटर, क्याल्कुलेटर,  आदिको खुद्रा विक्री गर्ने क्रियाकलापहरु।","Karpaita, watch, jewelry, book, derailment, Stationery goods, justified accessories, computer, calculator, etc. The retail selling activities."
5240,"सेकेण्ड हाइण्डका सामान  आदिको विक्री गर्ने क्रियाकलापहरु।","Second haindaka goods selling activities etc."
5252,"सडक पेटी, सार्बजनिक स्थल, घुम्ती पसल आदिमा खुद्रा विक्री गर्ने क्रियाकलापहरु।","Sidewalk, public places, the mobile market in the beginning of the retail sales activities."
5259,"हाटबजार, मेलामा वा भण्डिङ मेशिन द्धारा खुद्रा विक्री गर्ने क्रियाकलापहरु।","Stalls, fair or bhandina Retail sales of machinery and disbursement activities."
5260,"स्टोभ, छाता, मैनटोल, प्रेशर कुकर मर्मत गर्ने क्रियाकलापहरु।","Stove, umbrella, mainatola, pressure cooker repair activities."
5510,"होटल,लज, रेष्टुराँ, बार, क्याफे आदिको संचालन गर्ने क्रियाकलापहरु।","Hotels, lodges, restaurants, bars, cafés, etc. The activities conducted."
5520,"क्याटरीङ्ग सेवा प्रदान गर्ने क्रियाकलापहरु।","Kyataringa providing service activities."
6010,"रेल यातायात संचालन गर्ने क्रियाकलापहरु।","Rail transport activities operate."
6021,"बस, ट्रली बस, केबुल कार संचालन गर्ने क्रियाकलापहरु।","Bus, trolley bus, cable car and operate activities."
6022,"टाँगा, रिक्सा, टयाम्पू संचालन गर्ने क्रियाकलापहरु।","Carts, rickshaws, tayampu operational activities."
6023,"ट्रान्स्पोर्ट कंपनी, चौरी,गधा, खच्चर,गोरु गाडा,ठेल गाडा आदि वाट सामान वासार पसार गर्ने क्रियाकलापहरु।","Transporta company, yak, donkey, mule, ox carts, carts, etc. Watt lunge to stretch the activities vasara goods."
6120,"डुङ्गा,नौका, राफ्टीङ्ग, जल यातायातका साधन संचालन गर्ने क्रियाकलापहरु।","Boat, yacht, raphtinga, water transport means to conduct activities."
6210,"हवाइ जहाज, हेलीकप्टर, यएर ग्लाइडर, हट एअर वेलुनिङ्ग आदि संचालन गर्ने क्रियाकलापहरु।","By air, helicopter, glider yaera, Hot Air veluninga etc. The activities conducted."
6301,"कार्गो सेवा जस्तै यात्री वा व्यापारिक सामान लोड अन लोड गर्ने क्रियाकलापहरु।","Cargo services such as passenger or commercial goods on loading loading activities."
6302,"गोदाम, भण्डार आदिको संचालन गर्ने क्रियाकलापहरु।","Warehouse, storage, etc. The activities conducted."
6303,"बस, रेल, हवाइ स्टेशन आदिमा सामान वसार पसार गर्न सहयोग गर्ने क्रियाकलापहरु।","Bus, rail, air, station, carry goods to support activities in the beginning."
6304,"ट्राभल एजेन्सी, पर्यटन, ट्रेकिङ्ग सेवा संचालन गर्ने क्रियाकलापहरु।","Travel agency, tourism, trekinga service activities operate."
6309,"भंसार एजेण्ट सम्बन्धी सेवा संचालन गर्ने क्रियाकलापहरु।","Agent tariff related service activities operate."
6411,"चिठ्ठी पत्र, पार्सल, वुक पोष्ट, आदान प्रदान गर्ने र फीलाटेली सेवा संचालन गर्ने क्रियाकलापहरु।","Letter letter, parcel, post Wook, exchange and philateli service activities operate."
