name,formatted_address,vicinity,formatted_phone_number,international_phone_number,location-lat-lng,location-lat,location-lng,permanently_closed,rating,types,url,website,place_id
"Crown Relocations Packers & Movers","shop no.413, Rana Pratap Marg, Prem Nagar, Hazratganj, Lucknow, Uttar Pradesh 226001, India","shop no.413, Rana Pratap Marg, Prem Nagar, Hazratganj, Lucknow","090154 05454","+91 90154 05454","26.856135,80.948591",26.856135,80.948591,,,"food / store / storage / establishment",https://plus.google.com/117153751209818288949/about?hl=en-US,http://www.crownrelocations.co.in/,ChIJCSarE_DkDDkRpGCguaWKo-A
"Satguru Agencies, Lucknow","C-51, Sector D, L. D. A. Colony, Kanpur Road, Lucknow, Uttar Pradesh 226012, India","C-51, Sector D, L. D. A. Colony, Kanpur Road, Lucknow","0522 401 2609","+91 522 401 2609","26.796074,80.893307",26.796074,80.893307,,,establishment,https://plus.google.com/116324455696625010359/about?hl=en-US,http://www.indiamart.com/satguruagencies,ChIJ92Bhyqj-mzkRGPvfeDVIarI
"Docket Care Systems","Balmikinagar, Lucknow, Uttar Pradesh 226006, India","Balmikinagar, Lucknow","094150 08353","+91 94150 08353","26.863289,80.965589",26.863289,80.965589,,,establishment,https://plus.google.com/117428849882367344376/about?hl=en-US,http://www.docketcare.com/,ChIJj6TALUD9mzkR5Tc0zGqBlJo
"Official Website of MasterChef Pankaj Bhadouria","A - 7/6, Paper Mill Colony,, Nishatganj,, Lucknow, Uttar Pradesh 226006, India","A - 7/6, Paper Mill Colony,, Nishatganj,, Lucknow","098388 85555","+91 98388 85555","26.868377,80.959287",26.868377,80.959287,,,"cafe / food / establishment",https://plus.google.com/107594997338288649291/about?hl=en-US,http://www.pankajbhadouria.com/,ChIJhete0m79mzkR8cgTxapny9s
drcarbath,"89 Paper Mill Colony Nishatganj, Lucknow, Uttar Pradesh 226006, India","89 Paper Mill Colony Nishatganj, Lucknow","094531 92854","+91 94531 92854","26.874673,80.956711",26.874673,80.956711,,,establishment,https://plus.google.com/103981905236649886907/about?hl=en-US,,ChIJB_0sOQb9mzkRMXhvpTfReSM
"WILLIAM TRADING CO.","B-38, Kendriya Vihar, Jankipuram Vistar,, Jankipuram, Lucknow, Uttar Pradesh 226021, India","B-38, Kendriya Vihar, Jankipuram Vistar,, Jankipuram, Lucknow","093367 77222","+91 93367 77222","26.922194,80.94807",26.922194,80.94807,,,"home_goods_store / store / establishment",https://plus.google.com/105973675637875344824/about?hl=en-US,http://willam.tradeindia.com/,ChIJYekfIqxXmTkRhiKCbSmNiqs
"Quality Furniture","Near Paper Mill Crossing, Nishatganj, Hazratganj, Hazratganj, Lucknow, Uttar Pradesh 226001, India","Near Paper Mill Crossing, Nishatganj, Hazratganj, Hazratganj, Lucknow","0522 238 7051","+91 522 238 7051","26.87136,80.93481",26.87136,80.93481,,,establishment,https://plus.google.com/101540748748742391945/about?hl=en-US,,ChIJYy0Sf4n9mzkR9VflmVaRaNU
"Nishat Ganj Gurudwara","Paper Mill Colony, Nishatganj, Lucknow, Uttar Pradesh 226006, India","Paper Mill Colony, Nishatganj, Lucknow",,,"26.868181,80.956766",26.868181,80.956766,,,"place_of_worship / establishment",https://plus.google.com/115846038173246096008/about?hl=en-US,,ChIJgcsT-G79mzkR3boZiDci7Ss
"Nirmala Medical Store","In Front of Cardboard Factory, Jail Road, Udbhav Sewa Sansthan, ELDECO Udyan-1, Bhadruk, Lucknow, Uttar Pradesh 226002, India","In Front of Cardboard Factory, Jail Road, Udbhav Sewa Sansthan, ELDECO Udyan-1, Bhadruk, Lucknow","094500 19034","+91 94500 19034","26.790906,80.924936",26.790906,80.924936,,,"pharmacy / store / health / establishment",https://plus.google.com/118353128355709908114/about?hl=en-US,,ChIJ4UVWNXT8mzkRMpU_70hZuo0
"Nishatganj Motor Workshop","Near Paper Mill Crossing, Nishatganj, Ashok Marg, Balmikinagar, Lucknow, Uttar Pradesh 226006, India","Near Paper Mill Crossing, Nishatganj, Ashok Marg, Balmikinagar, Lucknow","093355 32459","+91 93355 32459","26.865468,80.956544",26.865468,80.956544,,,establishment,https://plus.google.com/106919274259710891503/about?hl=en-US,,ChIJp8J10239mzkRohgJcIeZFv0
"SER VEG FOODS","B-1/3 Paper Mill Colony, nishat ganj, Lucknow, Uttar Pradesh 226006, India","B-1/3 Paper Mill Colony, nishat ganj, Lucknow","095655 00500","+91 95655 00500","26.865424,80.952415",26.865424,80.952415,,,"restaurant / food / establishment",https://plus.google.com/108666620399210901725/about?hl=en-US,,ChIJh9SuIXL9mzkRMtF36yJ9gsY
"U. P. M. A. Stores","Shop No-6, New Market, Paper Mill Calony, Nishatganj, Balmikinagar, Lucknow, Uttar Pradesh 226007, India","Shop No-6, New Market, Paper Mill Calony, Nishatganj, Balmikinagar, Lucknow","099364 49996","+91 99364 49996","26.868133,80.956771",26.868133,80.956771,,,"store / establishment",https://plus.google.com/118212126281388536757/about?hl=en-US,,ChIJQfMb-G79mzkREoOoti8BMYA
"Raj Selection","Shop No-1, Paper Mill Calony Road, Nishatganj, Balmikinagar, Lucknow, Uttar Pradesh 226007, India","Shop No-1, Paper Mill Calony Road, Nishatganj, Balmikinagar, Lucknow","0522 238 1637","+91 522 238 1637","26.8682,80.957179",26.8682,80.957179,,,"clothing_store / store / establishment",https://plus.google.com/109477800962695379495/about?hl=en-US,,ChIJOy-C8279mzkRgkEJw9rGshM
"DR V Inter college","Shop No.- 1, Paper Mill Colony, Near Flyover, Nishatganj, Lucknow, Uttar Pradesh 226007, India","Shop No.- 1, Paper Mill Colony, Near Flyover, Nishatganj, Lucknow","095932 24878","+91 95932 24878","26.865904,80.955874",26.865904,80.955874,,,establishment,https://plus.google.com/109891637028402641014/about?hl=en-US,,ChIJSdR52G39mzkRHAfLt0qdHKA
"Chandni Makeup House","Near Gurudwara, New Market Paper Mill Colony, Nishantganj, Purana Haidarabad, Hasanganj, Lucknow, Uttar Pradesh 226007, India","Near Gurudwara, New Market Paper Mill Colony, Nishantganj, Purana Haidarabad, Hasanganj, Lucknow","095807 51980","+91 95807 51980","26.865268,80.954947",26.865268,80.954947,,,"store / establishment",https://plus.google.com/109054755669949098091/about?hl=en-US,,ChIJp6Mt5G39mzkR6GgGIYededs
"Chadani Make Up house","9, Paper Mill Colony, Papermill Colony, Near Gurudwara, Nishatganj, Lucknow, Uttar Pradesh 226007, India","9, Paper Mill Colony, Papermill Colony, Near Gurudwara, Nishatganj, Lucknow","099357 86494","+91 99357 86494","26.86604,80.95595",26.86604,80.95595,,,establishment,https://plus.google.com/115996188178326094126/about?hl=en-US,,ChIJRV2ed279mzkRSj6Ga1_j2vY
"Hardware Shop","34, Paper Mill Colony, Papermill colony, Near Gurudwara, Nishatganj, Lucknow, Uttar Pradesh 226007, India","34, Paper Mill Colony, Papermill colony, Near Gurudwara, Nishatganj, Lucknow","094150 14933","+91 94150 14933","26.86645,80.95606",26.86645,80.95606,,,"hardware_store / store / establishment",https://plus.google.com/115813416836130402175/about?hl=en-US,,ChIJp5OFem79mzkR0gff0T8PXEU
"Chawala Store","Near Paper Mill Market, NIshantganj, Purana Haidarabad, Hasanganj, Lucknow, Uttar Pradesh 226007, India","Near Paper Mill Market, NIshantganj, Purana Haidarabad, Hasanganj, Lucknow","098896 27150","+91 98896 27150","26.865581,80.955168",26.865581,80.955168,,,"food / store / establishment",https://plus.google.com/103057990758315613141/about?hl=en-US,,ChIJex7j4G39mzkRxD4_kJYnIic
"Sahil General Store","Paper Mill Market, Nishantganj, Purana Haidarabad, Hasanganj, Lucknow, Uttar Pradesh 226007, India","Paper Mill Market, Nishantganj, Purana Haidarabad, Hasanganj, Lucknow",,,"26.865608,80.955173",26.865608,80.955173,,,"food / store / establishment",https://plus.google.com/117220146414733960248/about?hl=en-US,,ChIJ5xf84G39mzkRln-8eBkQAF8
"Heena Cosmetic Shop","Paper Mill Market, Nishantganj, Purana Haidarabad, Hasanganj, Lucknow, Uttar Pradesh 226007, India","Paper Mill Market, Nishantganj, Purana Haidarabad, Hasanganj, Lucknow","091256 40719","+91 91256 40719","26.865703,80.955314",26.865703,80.955314,,,"store / establishment",https://plus.google.com/112760585658357088484/about?hl=en-US,,ChIJheh24G39mzkRvncqui_EQVg
"G P Pan Bandar","2, New Market, Paper Mill Colony, Near Flyover, Nishatganj, Lucknow, Uttar Pradesh 226007, India","2, New Market, Paper Mill Colony, Near Flyover, Nishatganj, Lucknow","097955 72786","+91 97955 72786","26.86754,80.95707",26.86754,80.95707,,,"store / establishment",https://plus.google.com/110087613977595413776/about?hl=en-US,,ChIJP9188279mzkRJ9xfdL9V1m8
"Supper Electricals","Shop No-6, Paper Mill Colony, Nishatganj, Lucknow, Uttar Pradesh 226007, India","Shop No-6, Paper Mill Colony, Nishatganj, Lucknow","095066 92688","+91 95066 92688","26.86597,80.95593",26.86597,80.95593,,,"store / establishment",https://plus.google.com/107982223912003956028/about?hl=en-US,,ChIJzTC-d279mzkR7p1C_AJwT9Y
"Abdul Hamid Mekup Store","8, Paper Mill Colony, Papermill Colony, Near Gurudwara, Nishatganj, Lucknow, Uttar Pradesh 226007, India","8, Paper Mill Colony, Papermill Colony, Near Gurudwara, Nishatganj, Lucknow","094539 03659","+91 94539 03659","26.86602,80.95594",26.86602,80.95594,,,"beauty_salon / establishment",https://plus.google.com/113808918831491684136/about?hl=en-US,,ChIJS8CYd279mzkRDfIFcN-g4OA
"Akhil Bhartya Khadi Gramoudayg","11, Paper Mill Colony, Paper Milk Colony, Near Gurudwara., Nishatganj, Lucknow, Uttar Pradesh 226007, India","11, Paper Mill Colony, Paper Milk Colony, Near Gurudwara., Nishatganj, Lucknow","0522 238 5858","+91 522 238 5858","26.86609,80.95597",26.86609,80.95597,,,"store / establishment",https://plus.google.com/118416797472941455271/about?hl=en-US,,ChIJnThwd279mzkRIG-vtQgFogg
"Amar Auto Garage","Paper Mill Road,Nishatganj, Ashok Marg, Balmikinagar, Lucknow, Uttar Pradesh 226007, India","Paper Mill Road,Nishatganj, Ashok Marg, Balmikinagar, Lucknow","096961 63291","+91 96961 63291","26.865422,80.956949",26.865422,80.956949,,,"car_repair / establishment",https://plus.google.com/116275552213858361953/about?hl=en-US,,ChIJMctILGz9mzkR89GqnA5QbpA
"King Readymade","19, Paper Mill Colony, Papermill Colony, Near Gurudwara, Nishatganj, Lucknow, Uttar Pradesh 226007, India","19, Paper Mill Colony, Papermill Colony, Near Gurudwara, Nishatganj, Lucknow","078605 29055","+91 78605 29055","26.86631,80.95602",26.86631,80.95602,,,"clothing_store / store / establishment",https://plus.google.com/106445896875246708649/about?hl=en-US,,ChIJk5-gcG79mzkRuVkFKfQmi5k
"Homeopathy Dispensery","32, Paper Mill Colony, Papermill Colony, Near Gurudwara, Nishatganj, Lucknow, Uttar Pradesh 226007, India","32, Paper Mill Colony, Papermill Colony, Near Gurudwara, Nishatganj, Lucknow","098390 25373","+91 98390 25373","26.86641,80.95606",26.86641,80.95606,,,"health / establishment",https://plus.google.com/110028047687436244036/about?hl=en-US,,ChIJHSd9em79mzkRym4DhWx-XoM
"Near Jilani Light House","36, Paper Mill Colony, Papermill colony, Near Police Chowki, Nishatganj, Lucknow, Uttar Pradesh 226007, India","36, Paper Mill Colony, Papermill colony, Near Police Chowki, Nishatganj, Lucknow","098390 71830","+91 98390 71830","26.86651,80.95608",26.86651,80.95608,,,establishment,https://plus.google.com/107513334622041511152/about?hl=en-US,,ChIJwxeWem79mzkRdBCCOgnBfe4
"Touch and Glow Beauty Parlour","3, New Market, Paper Mill Colony, Near Flyover, Nishatganj, Lucknow, Uttar Pradesh 226007, India","3, New Market, Paper Mill Colony, Near Flyover, Nishatganj, Lucknow","094150 26973","+91 94150 26973","26.86768,80.9571",26.86768,80.9571,,,"beauty_salon / establishment",https://plus.google.com/108256565436027678370/about?hl=en-US,,ChIJ12Ht8279mzkRFMJ4B5awhNg
"Assistant Professor Mayank Shekhar","D-1/1,paper mill colony nishatganj,, NH 28, Balmikinagar, Lucknow, Uttar Pradesh 226006, India","D-1/1,paper mill colony nishatganj,, NH 28, Balmikinagar, Lucknow","093898 73471","+91 93898 73471","26.868138,80.960961",26.868138,80.960961,,,establishment,https://plus.google.com/111294986737272385632/about?hl=en-US,,ChIJIW_22239mzkR_uCwy1nRV9s
"Homeopathic Clinic","Near Metro City,Paper Mill Colony, Balmikinagar, Lucknow, Uttar Pradesh 226006, India","Near Metro City,Paper Mill Colony, Balmikinagar, Lucknow","098357 48048","+91 98357 48048","26.864001,80.964385",26.864001,80.964385,,,"health / establishment",https://plus.google.com/103722406001235576907/about?hl=en-US,,ChIJ1akje2r9mzkRp41CrIwhvF0
"NIPER Raebareli","Shree Bhawani Paper Mill Road,, ITI compound, Raebareli,, Raebareli, Uttar Pradesh 229010, India","Shree Bhawani Paper Mill Road,, ITI compound, Raebareli,, Raebareli","0535 270 0857","+91 535 270 0857","26.754123,80.9227",26.754123,80.9227,,,establishment,https://plus.google.com/110236080684044199511/about?hl=en-US,http://niperraebareli.edu.in/contact.html,ChIJGTxcOLj7mzkRG7ieyz08ao0
"Anant Paper Products","Agra, Uttar Pradesh, India",Agra,"0562 252 3657","+91 562 252 3657","27.205495,78.034475",27.205495,78.034475,,,establishment,https://plus.google.com/111163976038031090035/about?hl=en-US,http://coloredtissue.com/,ChIJrYDOHiZ3dDkRyqozKBdT3_s
"Shree Goverdhan Paper Mart","Near Dr Ashok Garg 8/21/1, Seth Gali, Seth Gali, Agra, Uttar Pradesh 282003, India","Near Dr Ashok Garg 8/21/1, Seth Gali, Seth Gali, Agra","0562 226 7822","+91 562 226 7822","27.185254,78.014328",27.185254,78.014328,,,establishment,https://plus.google.com/106880895174941367517/about?hl=en-US,,ChIJvbvX-y13dDkR1cveQO-yxME
"Sahu Corrugated Packagings","State Highway 31, Tundla, Uttar Pradesh 283204, India","State Highway 31, Tundla","099170 00765","+91 99170 00765","27.228953,78.24394",27.228953,78.24394,,,"store / establishment",https://plus.google.com/116268459275959705896/about?hl=en-US,,ChIJJdHiJIZodDkRSZ7WIKpuB-Q
"Sahu Pack Well","Near Sangam Marriage Home,Basai Road, Tundla, Uttar Pradesh 283204, India","Near Sangam Marriage Home,Basai Road, Tundla","097566 01933","+91 97566 01933","27.224484,78.250404",27.224484,78.250404,,,establishment,https://plus.google.com/105406806257485175851/about?hl=en-US,,ChIJ580kNWJodDkR8IKIKFlSmig
"Standard Paper House","Near Holi Wali Gali, Annapurna Mandir Ke Nichhe, Chatta Bazar, Chatta Bazar, Mathura, Uttar Pradesh 281001, India","Near Holi Wali Gali, Annapurna Mandir Ke Nichhe, Chatta Bazar, Chatta Bazar, Mathura","0565 240 8148","+91 565 240 8148","27.500567,77.685767",27.500567,77.685767,,,establishment,https://plus.google.com/116699231743282749747/about?hl=en-US,,ChIJh2Ic-hBxczkRNHmSavgRkB8
"Moti Lal Jain & Sons","2/9, Seth Gali, Seth Gali, Agra, Uttar Pradesh 282003, India","2/9, Seth Gali, Seth Gali, Agra","0562 246 0681","+91 562 246 0681","27.185254,78.014328",27.185254,78.014328,,,establishment,https://plus.google.com/117552219390718936986/about?hl=en-US,,ChIJvbvX-y13dDkRavHbtUVQfDs
"Shree Shyam Packaging, Agra","5D/4, Albatia Road, Albatia, Shahganj, Agra, Uttar Pradesh 282010, India","5D/4, Albatia Road, Albatia, Shahganj, Agra","098970 33926","+91 98970 33926","27.18118,77.954591",27.18118,77.954591,,,establishment,https://plus.google.com/104978054166656334355/about?hl=en-US,http://www.indiamart.com/shree-shyam-packaging/,ChIJVVVVVbF3dDkRyCf1uCeyJ9Y
Harsons,"Rajendar Market, Opp. S N Medical College, Captain Naresh Road, Mantola, Agra, Uttar Pradesh 282002, India","Rajendar Market, Opp. S N Medical College, Captain Naresh Road, Mantola, Agra","0562 246 6149","+91 562 246 6149","27.186705,78.004469",27.186705,78.004469,,,"store / health / establishment",https://plus.google.com/100971167442642585526/about?hl=en-US,http://www.harsons.co.in/,ChIJqSaTEDt3dDkRczQfWno9N4g
"Jainaika Overseas","23/113, Lohamandi, Agra, Uttar Pradesh 282002, India","23/113, Lohamandi, Agra","0562 281 1393","+91 562 281 1393","27.189769,77.993976",27.189769,77.993976,,,establishment,https://plus.google.com/105983053363404944490/about?hl=en-US,http://www.jainaika.com/,ChIJ-SMS1RV3dDkRD2EuoQmDDno
"Trafo Power & Electricals Pvt Ltd.","C-20, UPSIDC, Industrial Area, Site C, Sikandra, Agra, Uttar Pradesh 282007, India","C-20, UPSIDC, Industrial Area, Site C, Sikandra, Agra","0562 309 0391","+91 562 309 0391","27.214449,77.931486",27.214449,77.931486,,,establishment,https://plus.google.com/111212445745578399513/about?hl=en-US,http://trafo.co.in/,ChIJ0aiTeQB4dDkRpiw8_r8Jj-w
"Marson's Electrical Industries","Mathura Road, Agra, Uttar Pradesh 282007, India","Mathura Road, Agra","098970 09444","+91 98970 09444","27.228307,77.895772",27.228307,77.895772,,,establishment,https://plus.google.com/110363819709066433763/about?hl=en-US,http://www.marsonselectricals.com/,ChIJNzNdbsaHczkRceaWIesriIs
"Dainik Jagran Press","Jhansi, Uttar Pradesh 284002, India",Jhansi,,,"25.494848,78.551445",25.494848,78.551445,,,establishment,https://plus.google.com/102140054571144217448/about?hl=en-US,,ChIJ4ba381hxdzkRRqinvIm54pg
"Shree Bhawani Paper Mills Limited","Doorbhash Nagar, Raebareli, Uttar Pradesh 229010, India","Doorbhash Nagar, Raebareli",,,"26.23259,81.26909",26.23259,81.26909,,,establishment,https://plus.google.com/108953743378824072150/about?hl=en-US,,ChIJ54mZarymmzkRyvRhJVnzrF8
"National Institite of Pharmaceutical Education and Research","Near Shree Bhawani Paper Mill, Doorbhash Kendra Marg, Doorbhash Nagar, Raebareli, Uttar Pradesh 229010, India","Near Shree Bhawani Paper Mill, Doorbhash Kendra Marg, Doorbhash Nagar, Raebareli",,,"26.231434,81.267747",26.231434,81.267747,,,establishment,https://plus.google.com/111136546954783274460/about?hl=en-US,,ChIJ0YYE8rummzkRIw0mIhUyd7A
"National Centre for Vehicle Research and Safety","Bhawani Paper Mill Road, Doorbhash Kendra Marg, Doorbhash Nagar, Raebareli, Uttar Pradesh 229001, India","Bhawani Paper Mill Road, Doorbhash Kendra Marg, Doorbhash Nagar, Raebareli",,,"26.229381,81.269004",26.229381,81.269004,,,"store / establishment",https://plus.google.com/111810009799301899922/about?hl=en-US,http://www.natrip.in/,ChIJ1Uv8q76mmzkRX-EmeYATHhA
"WATER FOUNDATION","21,Paper Mill Colony, Nishat Ganj, Lucknow, Uttar Pradesh 226006, India","21,Paper Mill Colony, Nishat Ganj, Lucknow","098392 89954","+91 98392 89954","26.867678,80.965477",26.867678,80.965477,,,establishment,https://plus.google.com/116670906079468495668/about?hl=en-US,,ChIJlydGDEL9mzkRzirtQYomJ3Y
"Maa Durga Hath Kagaj Udyog","Kalpi Dgawa Ratha Marg, Kalpi, Uttar Pradesh 285204, India","Kalpi Dgawa Ratha Marg, Kalpi","089609 69259","+91 89609 69259","26.120244,79.74672",26.120244,79.74672,,,establishment,https://plus.google.com/109782639578305970164/about?hl=en-US,,ChIJh8E8N9yhnTkR00mju1WTSN0
"Rama Shyma Papers Ltd.","Rajau Paraspur, Uttar Pradesh 243123, India","Rajau Paraspur",,,"28.289559,79.503057",28.289559,79.503057,,,establishment,https://plus.google.com/114225684821971691587/about?hl=en-US,,ChIJtf5Za2gCoDkRpkhuOoPYYX0
"Muzic Series Entertainments","2nd floor, 48- Private Paper Mill Colony,Nishatganj, Lucknow, Uttar Pradesh 226006, India","2nd floor, 48- Private Paper Mill Colony,Nishatganj, Lucknow","075700 05000","+91 75700 05000","26.86732,80.96553",26.86732,80.96553,,,establishment,https://plus.google.com/115625799090765597477/about?hl=en-US,http://www.muzicseries.com/,ChIJod6gD0L9mzkR6AuiPm9xLx4
"The BHARATPUR Swaraj","Opposite Bharatpur Bird Sanctuary, Jawahar Nagar, Bharatpur, Rajasthan 321001, India","Opposite Bharatpur Bird Sanctuary, Jawahar Nagar, Bharatpur","099502 51206","+91 99502 51206","27.206962,77.500614",27.206962,77.500614,,4,"lodging / establishment",https://plus.google.com/112028321966326069402/about?hl=en-US,http://www.theswaraj.com/,ChIJ_bkULhSjczkR3T6QNOb_WGw
"Shree Bhawani Paper Mills Limited","33, Dayanand Marg, Dayanand Marg, Allahabad, Uttar Pradesh 211002, India","33, Dayanand Marg, Dayanand Marg, Allahabad","0532 260 7956","+91 532 260 7956","25.460852,81.825603",25.460852,81.825603,,,establishment,https://plus.google.com/113768810186837977013/about?hl=en-US,http://shbhawani.com/,ChIJZVmY8ODKmjkRDqC22p_wmEE
"Maihar Cement","15/33, Stanley Road, Stanley Road, Allahabad, Uttar Pradesh 211003, India","15/33, Stanley Road, Stanley Road, Allahabad","0532 260 9106","+91 532 260 9106","25.478424,81.850249",25.478424,81.850249,,,establishment,https://plus.google.com/109517998307137049123/about?hl=en-US,,ChIJ74WBUInKmjkRx3KfRIC26fQ
"Natraj Paper Corporation","117/130, K.P.Kakkar Road, Allahabad, Uttar Pradesh 211003, India","117/130, K.P.Kakkar Road, Allahabad","0532 240 2411","+91 532 240 2411","25.439146,81.836314",25.439146,81.836314,,,"store / establishment",https://plus.google.com/116382601391863744748/about?hl=en-US,,ChIJL5uXU8zKmjkRqlgOD78_RIA
"Bajaj And Company","100, Zero Road, Allahabad, Uttar Pradesh 211003, India","100, Zero Road, Allahabad","094150 21750","+91 94150 21750","25.439453,81.836844",25.439453,81.836844,,,establishment,https://plus.google.com/100085456298569720658/about?hl=en-US,,ChIJyWOzWszKmjkRY54fWjqJK5s
"Saraswati Paper House","46-B, Zero Rd, Chah Chand, Allahabad, Uttar Pradesh 211003, India","46-B, Zero Rd, Chah Chand, Allahabad","0532 240 0479","+91 532 240 0479","25.439819,81.837442",25.439819,81.837442,,,establishment,https://plus.google.com/102189175947697637121/about?hl=en-US,,ChIJ9eIFQszKmjkRPcaVt-68-EU
"Chaurasia Paper Store","68/102, Zero Road, Zero Road, Zero Road, Allahabad, Uttar Pradesh 211003, India","68/102, Zero Road, Zero Road, Allahabad","0532 240 1487","+91 532 240 1487","25.438864,81.839423",25.438864,81.839423,,,establishment,https://plus.google.com/105352955088348459607/about?hl=en-US,,ChIJ0Yg_C8vKmjkRuYfekJGCpBY
"paras paper mills","c 20 upsidc naini industrial area naini, Allahabad, Uttar Pradesh 211012, India","c 20 upsidc naini industrial area naini, Allahabad","0532 329 2927","+91 532 329 2927","25.39242,81.792526",25.39242,81.792526,,,establishment,https://plus.google.com/109432857904963742889/about?hl=en-US,,ChIJhwzK1Y40hTkRSSo_-zC5VFs
"Ravi Traders","Near D Road, 28/27, AD Road, Kotha Parcha, Allahabad, Uttar Pradesh 211003, India","Near D Road, 28/27, AD Road, Kotha Parcha, Allahabad","098398 24674","+91 98398 24674","25.436584,81.844475",25.436584,81.844475,,,establishment,https://plus.google.com/106284320712292203727/about?hl=en-US,,ChIJUbOBVrXKmjkRayuUDu_3GGQ
"Mittal Paper And Boards","101/54, Bahadurganj, Bahadurganj, Allahabad, Uttar Pradesh 211003, India","101/54, Bahadurganj, Bahadurganj, Allahabad","0532 265 0063","+91 532 265 0063","25.435801,81.846311",25.435801,81.846311,,,establishment,https://plus.google.com/111909092525286961587/about?hl=en-US,,ChIJlauYbdHKmjkR6UrPdKcNeJA
"Dayal Board Mills","129a/6c, Himmatganj, 240/1296c, M G Road, M G Road, Allahabad, Uttar Pradesh 211001, India","129a/6c, Himmatganj, 240/1296c, M G Road, M G Road, Allahabad","0532 261 5028","+91 532 261 5028","25.435801,81.846311",25.435801,81.846311,,,establishment,https://plus.google.com/112964510647675223698/about?hl=en-US,,ChIJlauYbdHKmjkRBCKIAA5SFdI
"Delight Business Point","Opp Bhikampur, LDA Colony, Paper Mill Road, Nishatganj, Butler Road, Balmikinagar, Lucknow, Uttar Pradesh 226006, India","Opp Bhikampur, LDA Colony, Paper Mill Road, Nishatganj, Butler Road, Balmikinagar, Lucknow","0522 233 9972","+91 522 233 9972","26.862915,80.965703",26.862915,80.965703,,,establishment,https://plus.google.com/102505321103694942664/about?hl=en-US,,ChIJ3WMeMED9mzkRouGWMN3fexo
Technomobiles,"Paper Mill Colony,Nishatganj, Balmikinagar, Lucknow, Uttar Pradesh 226006, India","Paper Mill Colony,Nishatganj, Balmikinagar, Lucknow","094151 04954","+91 94151 04954","26.863757,80.964711",26.863757,80.964711,,,"store / car_repair / establishment",https://plus.google.com/107840991860591973175/about?hl=en-US,,ChIJGyiRfmr9mzkRvAFQ7eaLvXw
"Yash Papers","Yash Nagar, Faizabad, Uttar Pradesh, Nawab Yousuf Road, Uttar Pradesh 224135, India","Yash Nagar, Faizabad, Uttar Pradesh, Nawab Yousuf Road","05278 326 611","+91 5278 326 611","26.739072,82.227768",26.739072,82.227768,,4.3,establishment,https://plus.google.com/102463496364065358321/about?hl=en-US,http://www.yash-papers.com/,ChIJEWDOQpCnkDkRX-RFpiz83io
"Khushid H Electonics","Paper Mill Colony, Balmikinagar, Lucknow, Uttar Pradesh 226006, India","Paper Mill Colony, Balmikinagar, Lucknow","094159 12076","+91 94159 12076","26.863903,80.964477",26.863903,80.964477,,,"electronics_store / store / establishment",https://plus.google.com/100270338609352504698/about?hl=en-US,,ChIJmSZ4e2r9mzkRo-5KTBt0Yi0
"Aditya Stationers","Paper Mill Colony, Balmikinagar, Lucknow, Uttar Pradesh 226006, India","Paper Mill Colony, Balmikinagar, Lucknow","087551 74594","+91 87551 74594","26.863867,80.964252",26.863867,80.964252,,,"store / establishment",https://plus.google.com/105299704065544026818/about?hl=en-US,,ChIJAaCmZGr9mzkRKXI_ncR1JQk
Digitrax,"C-25/9, Paper Mill Colony, Lucknow, Uttar Pradesh 226006, India","C-25/9, Paper Mill Colony, Lucknow","0522 233 5124","+91 522 233 5124","26.864835,80.964796",26.864835,80.964796,,,establishment,https://plus.google.com/111982644841891974871/about?hl=en-US,,ChIJ0db6dGr9mzkR1bca1jlV2fk
"Anant Corrugators","M/s Anant Corrugators, Goolar Road, Aligarh, Uttar Pradesh 202001, India","M/s Anant Corrugators, Goolar Road, Aligarh","098370 16000","+91 98370 16000","27.892143,78.061015",27.892143,78.061015,,,establishment,https://plus.google.com/110858956433301264386/about?hl=en-US,,ChIJ7wjfH2GkdDkR3sXhl3bKUZ0
"Everest Industries Ltd","One of the Five Works in India of M/s Everest Industries Ltd. It was established in he year 1934 by Turner & Newal group of England.It is Indias first Asbestos Cement corrugated sheets manufacturing Company., India","One of the Five Works in India of M/s Everest Industries Ltd. It was established in he year 1934 by Turner & Newal group of England.It is Indias first Asbestos Cement corrugated sheets manufacturing Company.","07626 272 517","+91 7626 272 517","24.052774,80.60375",24.052774,80.60375,,,"store / establishment",https://plus.google.com/110051858200222651493/about?hl=en-US,http://www.everestind.com/,ChIJ_7Wsk47vgzkR9scdGxAGXas
"U P Paper Mart","Chowk, Kabir Road, Kabir Road, Varanasi, Uttar Pradesh 221001, India","Chowk, Kabir Road, Kabir Road, Varanasi","093353 76548","+91 93353 76548","25.311783,83.010233",25.311783,83.010233,,,establishment,https://plus.google.com/102356039968139474352/about?hl=en-US,,ChIJ26xFkR4ujjkR2m4Mt8xx_jw
